{
  "schema_version": "simworld.vista.playable-house/v1",
  "house_id": "home.r1",
  "revision": "vista_playable_home_r1",
  "seed": 20260815,
  "units": "meters",
  "coordinate_system": {"handedness": "right", "up_axis": "z", "forward_axis": "x"},
  "asset_catalog": [
    {"asset_id": "asset.bundle.entry_hall", "source_kind": "bundle", "uri": "bundle://vista-playable-home-r1/entry-hall", "source_digest": "3092db8f7211026a2a3082aa1c858dcdb77195bdff148ca67b5bf4ab64051a46", "license": "research-fixture-only"},
    {"asset_id": "asset.bundle.living_room", "source_kind": "bundle", "uri": "bundle://vista-playable-home-r1/living-room", "source_digest": "98ad1ffbc8f3822924f8ff7531a280e631c5636d36d78a4ff317eceeefb621cc", "license": "research-fixture-only"},
    {"asset_id": "asset.bundle.kitchen_dining", "source_kind": "bundle", "uri": "bundle://vista-playable-home-r1/kitchen-dining", "source_digest": "509d535c17a9bbcca426bf77b939af1a67185922dc59729c1634468671061fda", "license": "research-fixture-only"},
    {"asset_id": "asset.bundle.bedroom", "source_kind": "bundle", "uri": "bundle://vista-playable-home-r1/bedroom", "source_digest": "0b7eef00b5829beb1498980f184aa4a27507db2cf4d956d4acf25d4ed8b0eadb", "license": "research-fixture-only"},
    {"asset_id": "asset.bundle.office", "source_kind": "bundle", "uri": "bundle://vista-playable-home-r1/office", "source_digest": "d9e87d98730112980208a72c409ec2af7a9173c8b4d7f1cfaf48391108a94ccb", "license": "research-fixture-only"},
    {"asset_id": "asset.bundle.bathroom_laundry", "source_kind": "bundle", "uri": "bundle://vista-playable-home-r1/bathroom-laundry", "source_digest": "379a86768d7e46a1d9263327c29cb219a8a92d24a7fd37ddf5d37437a391bad1", "license": "research-fixture-only"},
    {"asset_id": "asset.runtime.player", "source_kind": "builtin", "uri": "builtin://vista/playable-home/pawn", "source_digest": "9bb33e653aeb7e663e785d2dd6e5cc9e827919d911b6a2d5da82d90722279f70", "license": "project-builtin"},
    {"asset_id": "asset.runtime.game_mode", "source_kind": "builtin", "uri": "builtin://vista/playable-home/game-mode", "source_digest": "4f75fb7da6a018dceef7365511f478702c5681eb30222bd8d9a462964f298c28", "license": "project-builtin"},
    {"asset_id": "asset.runtime.npc", "source_kind": "builtin", "uri": "builtin://vista/playable-home/npc", "source_digest": "159fe8cfee3de4f1aecd8a7b201c497c3196aec8b94114e8ba0da4d812bc91c7", "license": "project-builtin"},
    {"asset_id": "asset.door.interior", "source_kind": "procedural", "uri": "procedural://vista-playable-home/interior-door", "source_digest": "5ecfa114e291d632fa61e58d5c01fed6d59d2af1d6a8674ecf3c27ca06d644f7", "license": "generated-project-asset"},
    {"asset_id": "asset.door.exterior", "source_kind": "procedural", "uri": "procedural://vista-playable-home/exterior-door", "source_digest": "bfd07aa16e6571f9ea18c60909cbd46dd08846523b31300abbc22ca07e9f00bd", "license": "generated-project-asset"},
    {"asset_id": "asset.prop.shoe_bench", "source_kind": "bundle", "uri": "bundle://vista-playable-home-r1/props/shoe-bench", "source_digest": "3c71708cb97b100c6d198da21248e3d4aaafa9f3a6cbd3b4c994ed2b60c8efb9", "license": "research-fixture-only"},
    {"asset_id": "asset.prop.sofa", "source_kind": "bundle", "uri": "bundle://vista-playable-home-r1/props/sofa", "source_digest": "e97f4c1e67bd172513a1cf5b3061514bf3c9d63f7c1d0f1627a601db6e33492e", "license": "research-fixture-only"},
    {"asset_id": "asset.prop.coffee_table", "source_kind": "bundle", "uri": "bundle://vista-playable-home-r1/props/coffee-table", "source_digest": "24fd5be9e519da128655d7bc5008d517ce63da40a8be08d1454063456518c9e1", "license": "research-fixture-only"},
    {"asset_id": "asset.prop.keys", "source_kind": "bundle", "uri": "bundle://vista-playable-home-r1/props/keys", "source_digest": "2b6b743592f81446388fbaf7d22da43df71b8df12e76ec462a5d90bdc9f2290e", "license": "research-fixture-only"},
    {"asset_id": "asset.prop.slipper", "source_kind": "bundle", "uri": "bundle://vista-playable-home-r1/props/slipper", "source_digest": "b2cc25a87c03b1a71343eee0bf394355fe8b1c2a87513f01de506f3be782a493", "license": "research-fixture-only"},
    {"asset_id": "asset.prop.spill_marker", "source_kind": "bundle", "uri": "bundle://vista-playable-home-r1/props/spill-marker", "source_digest": "58b84fabf66888508fa91eba04342ecd133cb958d8c6918c55f57916536667a3", "license": "research-fixture-only"},
    {"asset_id": "asset.prop.stove", "source_kind": "bundle", "uri": "bundle://vista-playable-home-r1/props/stove", "source_digest": "f7a7ec668d3bf594f8645083f42054761574830315e14283b73679095b415ec8", "license": "research-fixture-only"},
    {"asset_id": "asset.prop.pot", "source_kind": "bundle", "uri": "bundle://vista-playable-home-r1/props/pot", "source_digest": "8902b928ed03cc4ff0abc7af65b8a9773a7ac09c7a33a99bf072be6d3a63e29a", "license": "research-fixture-only"},
    {"asset_id": "asset.prop.dining_table", "source_kind": "bundle", "uri": "bundle://vista-playable-home-r1/props/dining-table", "source_digest": "5cbc0dd58a8449332d501cf2d25be6037ab6557f5dab0f35fc494d2127701d55", "license": "research-fixture-only"},
    {"asset_id": "asset.prop.coffee_cup", "source_kind": "bundle", "uri": "bundle://vista-playable-home-r1/props/coffee-cup", "source_digest": "b197bbf71ea76da9276ec742fc6495eefb3bd06843522cb9209744e147bfee54", "license": "research-fixture-only"},
    {"asset_id": "asset.prop.fridge", "source_kind": "bundle", "uri": "bundle://vista-playable-home-r1/props/fridge", "source_digest": "25100e007c847d170c3da3aabbeabe4406d97e1711c90ffc3abcfdae55aa9f53", "license": "research-fixture-only"},
    {"asset_id": "asset.prop.fire_marker", "source_kind": "bundle", "uri": "bundle://vista-playable-home-r1/props/fire-marker", "source_digest": "2674b7a4daffcd8a03dc569a5cce40aaf565cb83ea1375a64ef0e84e41fb59f3", "license": "research-fixture-only"},
    {"asset_id": "asset.prop.bed", "source_kind": "bundle", "uri": "bundle://vista-playable-home-r1/props/bed", "source_digest": "51f8fc44a516e0ae3837e5731a892eb05b0a34691b9e3e7057bf714fca2c6147", "license": "research-fixture-only"},
    {"asset_id": "asset.prop.nightstand", "source_kind": "bundle", "uri": "bundle://vista-playable-home-r1/props/nightstand", "source_digest": "72bd8e1fe3b971d504aacc0a4dc81a44322aa5ec1cfb6664df5a4ffa9d0aa46a", "license": "research-fixture-only"},
    {"asset_id": "asset.prop.phone", "source_kind": "bundle", "uri": "bundle://vista-playable-home-r1/props/phone", "source_digest": "1fb2d7d4db67ba1805d780e474c55b363e84cf1ab693779a59a8dc952fb72ae5", "license": "research-fixture-only"},
    {"asset_id": "asset.prop.backpack", "source_kind": "bundle", "uri": "bundle://vista-playable-home-r1/props/backpack", "source_digest": "cdc7a55b39395bf8e92f835cc1ec9f8567520a4deea43a351386a982d63d7a22", "license": "research-fixture-only"},
    {"asset_id": "asset.prop.desk", "source_kind": "bundle", "uri": "bundle://vista-playable-home-r1/props/desk", "source_digest": "4efe889d4bc708aa6a851f3ad01114d725b6cc104805572f78b968c9790fd0f3", "license": "research-fixture-only"},
    {"asset_id": "asset.prop.rolling_chair", "source_kind": "bundle", "uri": "bundle://vista-playable-home-r1/props/rolling-chair", "source_digest": "8304bd3efcc9df8efd5e00f9f4a0e311b4d68056b6a712b821ed483959165b13", "license": "research-fixture-only"},
    {"asset_id": "asset.prop.cabinet", "source_kind": "bundle", "uri": "bundle://vista-playable-home-r1/props/cabinet", "source_digest": "d13f406b0ac876729ed2ee5f203d0b9485a0583cb6dd351e548a4427098e0337", "license": "research-fixture-only"},
    {"asset_id": "asset.prop.cardboard_box", "source_kind": "bundle", "uri": "bundle://vista-playable-home-r1/props/cardboard-box", "source_digest": "ef9c99e2cc06c3f8b7196c7266cc76f4dc1727411317a98efdd078b704e3d651", "license": "research-fixture-only"},
    {"asset_id": "asset.prop.ladder", "source_kind": "bundle", "uri": "bundle://vista-playable-home-r1/props/ladder", "source_digest": "6145b6ad8a18f6b0faae4e4b04945b61e9c25d4ae25ffaaa00b15054935d5e11", "license": "research-fixture-only"},
    {"asset_id": "asset.prop.bathtub", "source_kind": "bundle", "uri": "bundle://vista-playable-home-r1/props/bathtub", "source_digest": "8df772c20a4bbbe3af03ec107abd79ced3730a894201254f99fb40805a017ece", "license": "research-fixture-only"},
    {"asset_id": "asset.prop.faucet", "source_kind": "bundle", "uri": "bundle://vista-playable-home-r1/props/faucet", "source_digest": "20e0d677a7997cede9a00ecdf65d04f2103798288a311b375f1f488452508b39", "license": "research-fixture-only"},
    {"asset_id": "asset.prop.washer", "source_kind": "bundle", "uri": "bundle://vista-playable-home-r1/props/washer", "source_digest": "01e9169b4dabe5f647b3f8e1f788a59e6e67714d42135de3481ad79a153a01ff", "license": "research-fixture-only"},
    {"asset_id": "asset.prop.laundry_basket", "source_kind": "bundle", "uri": "bundle://vista-playable-home-r1/props/laundry-basket", "source_digest": "ec16a641b9f64e89970cfec1aa762af23788e2d9bba1e3a736d5d4dfb134d434", "license": "research-fixture-only"},
    {"asset_id": "asset.prop.clothes", "source_kind": "bundle", "uri": "bundle://vista-playable-home-r1/props/clothes", "source_digest": "fd854f4b9c9d58ebf5b75556f61aa289a9fc68eb769b3f4dd627362d1e577bb1", "license": "research-fixture-only"},
    {"asset_id": "asset.prop.overflow_marker", "source_kind": "bundle", "uri": "bundle://vista-playable-home-r1/props/overflow-marker", "source_digest": "42e00ed94532cf170cd9ebdcd1669a51535b6dab08588f6a2031883f6abed75c", "license": "research-fixture-only"}
  ],
  "rooms": [
    {
      "room_id": "home.r1/room.entry_hall", "kind": "entry_hall", "label": "Entry and Hall",
      "bundle_asset_ref": "asset.bundle.entry_hall",
      "transform": {"location_m": [0, 0, 0], "rotation_deg": [0, 0, 0], "scale": [1, 1, 1]},
      "bounds_m": {"min_m": [-1.5, -4, 0], "max_m": [1.5, 4, 3]},
      "anchor_m": [0, 0, 0.1],